page,date,status,diff
https://ised-isde.canada.ca/site/ised/en/canadas-regional-development-agencies,N/A,TRIVIAL CHANGE!," Federal Economic Development Agency for Northern Ontario (FedNor)<br> Supporting businesses and community partners to build a stronger Northern Ontario.<br> Prairies Economic Development Canada (PrairiesCan)<br><span style='color: red;'>-Supporting business, innovation and community economic develoto grow and entrepreneurs and innovators to start businesses, creating the ideal conditions for the development of strong, dynamic and inclusive regional economies throughout the country.</span><br><span style='color: green;'>+Supporting business, innovation and community economic development unique to Alberta, Saskatchewan and Manitoba.</span><br><span style='color: green;'>+Pacific Economic Development Canada (PacifiCan)</span><br><span style='color: green;'>+Supporting business, innovation and community economic development unique to British Columbia.</span><br><span style='color: green;'>+Supporting regional economic growth through innovation</span><br><span style='color: green;'>+RDA programs foster the right environment to enable businesses to grow and entrepreneurs and innovators to start businesses, creating the ideal conditions for the development of strong, dynamic and inclusive regional economies throughout the country.</span><br> Regional Development Agencies support regional innovation ecosystems and help businesses scale up by:<br> delivering nationally coordinated programs tailored to fit regional needs and circumstances<br> providing access to financial assistance"
www.test.io,2025-02-11 15:49:02,No Change!,NO CHANGES TO THE CONTENT!
